score,title,time,review10,I was with the Navy. Not the Navajo.,10 March 2016,"As an Avid Jurassic Park fan except for JP3. This film hit me a well thought after movie. There were some draw backs that you read in the comments pages like how could Claire out run a T-Rex in hill and another which i do agree with is that the kids should have been eaten because they were to whiny. It hard to replace performances from the original cast who played lex and tim. As for the CG and Graphics I'm always blown away on how it keeps changing and the dinosaurs always look better. as well as adding a hybrid well, let me tell great choice of adding a raptor rex mix. As the film progressed I was hoping for more dinos in the scene such a the mosasaurus. Other than that I give this film a big thumbs up."
10,"Don't let people mislead you with sentimentalism, it holds it self by its own as an excellent movie",11 June 2015,"Is a solid movie and it holds itself as a trilling experience for everyone. Yes, people from the original cast are not there, however there is actually not a logical reason in the time line to make them go back. Taking out this little detail, the acting is amazing and Chris Pratt holds amazingly as a main character again . Animations are better than ever and the story line even if a little prematurely developed is exciting and looks to reward the new audience as well as the hard on fans. Overall is a great movie which promise enjoyment. I loved it and I will recommend it for everyone that is a fan and for the ones that just want to see a movie that will print a smile at the end."
10,Loved it,28 June 2015,"I loved this movie. I don't understand some of the negative ratings here. This is not a Fellini movie we're reviewing. It's dinosaurs. And plenty of them. I think this is every bit as good as JPI and way better than the other two. There's plenty of action. There are strong characters, big dinosaurs, spectacular special effects. Add a star because it's scary without being gruesome. The plot is plausible in a movie that's based on a totally fantastical platform to start with. Go see it. Definitely one to see on the big screen. It's got a huge box office for a reason. People spontaneously clapped at the start of the ending credits. It's been a long time since I've seen a movie where that happened."
10,Another watchable instalment,17 June 2015,"17 June 2015 Film of Choice at The Plaza Dorchester Tonight - Jurassic World. Let's just say I'm a BIG fan of these movies, right from the minute we saw Sir Richard Attenborough clutching that cane with the amber head, I was hooked. I don't care that it's fiction and highly improbable, what matters is that these films take me to another land and in many ways another time.....65 million years ago to be precise. To be honest there wasn't anything terribly new in this film, two children, a rugged hero type, a woman running around in her high heels and a man with an alternative agenda. What we did get however, was dinosaurs on our side, and I love that. As portrayed in the film, the public want bigger, scarier attractions and a film going audience in a sense want that too. In this film however, we got more of the thinking man's dinosaur and a gaggle of well meaning people whose intentions were good but misplaced, a a couple of characters who really need to get eaten. I watched it in 3D, and I'm selective about the films I watch in 3D these days, but I have to say I was pretty darn good. Wouldn't mind watching it again......oh and Chris Prattt.....yum."
10,Dinos return to glory days,11 June 2015,"JURASSIC WORLD I do so love when a movie series returns to its creative roots. JURASSIC PARK was an epic film, and then Spielberg and company found a way to destroy its flavor with two banal sequels. After a lengthy hiatus that included much soul-searching, and dumping Jack Horner, JURASSIC WORLD brings the franchise back to the wonderfulness of the original.I try to not watch trailers before I see a movie. Often, they are misleading. At best, the reveal too many key plot elements or scenes. Unfortunately, the trailers for JURASSIC WORLD permeated media in a major advertising campaign blitz. What I saw in the trailers alarmed me. Did I actually see Velociraptors work along side the film's protagonist Chris Pratt, as a unified force? It reminded me of ALIENS VS. PREDATOR, where viewers were force-fed the notion a petite black woman was the only human representative capable of defeating a horde of aliens by teaming with the creatures who hunt humans for sport. Please. The concept was idiotic, and though they tried to salvage the movie series with a follow-up, the initial theme essentially destroyed the franchise in the world of celluloid.The raptors, in the same frame with Pratt, are not friendly creatures. Luckily, there are no ""we are family"" moments between species. I'll test your memory here, but think back to the second film in the CREATURE FROM THE BLACK LAGOON series; THE REVENGE OF THE CREATURE. In the film, John Agar, experimenting on the intelligence of the gill-man, uses an electric prod to teach the word ""stop"" to the Creature. Through Pavlovian testing, the Creature hesitates at the sound. It establishes a necessary reaction for the climatic scene. The raptors work much the same manner in JURASSIC WORLD. It is done well.Now, consider Jack Horner. After JURASSIC PARK, Horner attempted to garner his fifteen minutes of Andy Warhol fame and used rather sketchy paleontology findings to discredit the Tyrannosaurus Rex. He claimed the King of Dinosaurs was nothing but a mooching scavenger. Somehow, he convinced Spielberg to shift attention away from Rex. It was a bad move that culminated in a horrendous JURASSIC PARK 3, where a Spinosaurus, which in reality measured only 20 feet compared to T-rex's 50 feet, fights and defeats Rex. Horner's new Rex theories were dismantled by his peers and colleagues within a year. He is now in the café of scientific oblivion, sipping coffee with the two researchers who tried to convince us of global warming with a fabricated hockey stick graph model. Rex is back in full glory in JURASSIC WORLD. In fact, he received cheers and applause from the preview audience when he appeared on screen. They were louder than any reaction to superheroes.JURASSIC WORLD makes many references to the original, and basically ignores everything from the sequels. It is twenty years past John Hammond's disastrous attempt to bring dinosaurs to a theme park. In that time, technology has improved, enabling Hammond's dream to become reality. Thousands of people visit JURASSIC WORLD on a regular basis, but as with all things, dinosaurs become mundane with the public and the park must find new and exciting ways to keep ticket sales booming. Enter Indominus Rex, a genetically built dinosaur hybrid, meant to add an element of fear and terror to park visitors. BD Wong returns as Dr. Henry Wu, and is the culprit behind creation of the new Rex. He is reminiscent of Dr. Susan McCallister, played by Saffron Burrows, in DEEP BLUE SEA, who created superior sharks, but opted not to tell anyone about the enhances features.In keeping with the Spielberg tradition of constantly putting children in danger, Ty Simpkins and Nick Robinson star as Gray and Zach, who are visiting the park while their parents attempt to end their marital bliss. There can never be happy families anymore in films. It doesn't fit the template of a dysfunctional society, so loved by liberal Hollywood ideology. Entrusted to the care of their aunt, the boys naturally find a way to immerse themselves in park havoc, while they discover the bond that exists between brothers. Meanwhile, Auntie Claire, played by Bryce Dallas Howard, while chasing the All American Woman Executive Dream, has the hots for Owen (Pratt), who is in this story what Robert Muldoon should have been in the first. All these subplots are secondary and just provide hurdles for a tale about a genetic freak, and the dinosaurs who hate him.Critics were able to see JURASSIC WORLD in 3D. It is worth it. The dinos, especially the raptor attacks, are superb. The dinos look great, thanks to Ed Verreaux's production design. Cinematography by John Schwartzman is excellent and provides several iconic moments sure to appear on posters and memes. Music, though featuring additional tunes by Michael Giacchino is basically variations on John Williams memorable score.All in all, JURASSIC WORLD brings the series back to where it belongs. You can watch the first one, skip the second and third, and jump straight to this one and have a better franchise. The movie is filled with dinosaurs and dinosaur action. It's worth repeated views and deserves a spot on your home video shelf. As such, it exemplifies excellence in film entertainment and captures the coveted Fist of Fiore Award for 2015. You'll like this one; it's a keeper.10/10"
10,Pratt+Blackwater+Dinosaurs= A Masterpiece,13 June 2015,"OMG I don't even know where to start. I will start I suppose by saying this is in my opinion the Best movie in the series thus far and I know there will be a debate about this but that is how I feel. I watched it in IMAX 3D. I will start with the story which is basic it's about the park finally being opened to tourists after twenty plus years and everything going to Hell. I loved the pacing of the movie though because it doesn't just start with guns blazing it's a slow sizzle to some Fantastic set pieces in cinematography. I would also like to note that they had everything you would want to see in terms of tourists interacting with the park and enjoying it before the fun begins. I would compare it to ""28 Weeks Later"" and them settling down before the Zombie outbreak starts. I will move on to the acting which was very well done Chris Pratt killed it as Owen and was by far the star of the movie. I also have to mention Bryce Dallas Howard as Claire and also Vincent D' Onofrio who played Hoskins. I also enjoyed the banter between the brothers in the movie. Overall they all did a wonderful job of bringing life to the movie. I will now move onto the final part which is the action. I absolutely fell in love with the action set-pieces they were utilized perfectly and not overused. I can only compare it to Godzilla 2014 in terms of fight scenes between the Dinosaurs. I must say that once Blackwater or AKA InGen soldiers came into the mix I was sold. I will say this without spoiling anything that they had a nostalgic scene with Raptors just like the scene in ""The Lost World"". I will close by saying that if you are debating on watching this movie just GO and watch it and I guarantee that you will love it. The final fight scene was Phenomenal."
10,Best one so far!,14 June 2015,"Personally think this is the best of all four movies so far with the hybrid and, of course, the Raptors. This movie, regardless of what others say, is definitely worth the cinema ticket price and I would watch it time and time again.So, as a die hard Jurassic Park fan, I was really looking forward to this sequel and was not let down at all! The second a hybrid dinosaur plot was revealed, I was all in; hoping for a Tyrannosaurus-Velociraptor mix (let's face it, everyone who is a fan would be wishing for that). Wish granted, minus a few other dinosaurs apparently added to that already remarkable mix. The Indominus keeps the movie freshly updated and brings something new and exciting but my favourite thing about Jurassic World is easily the Velociraptors! Blue being the main object of my affection; how can you not love her? Charlie, Delta and Echo are cute too, but as you'll see bear the end, Blue is awesome!"
10,JW - Satisfying Sequel,11 June 2015,"So after being hyped up a lot about this film, booking tickets month in advance, Finally got to see it. I wish it had more impact but it was still a good film. Pros: Nice well paced , Decent acting (kids aren't annoying as some people feared, they did a good job), Funny (nice small jokes not overly done), Lot of Dino's, Nostalgia feels, Visuals/beautiful scenes Cons: Slightly on the predictable side, More of an action ride than an adventure ride, some characters needed more screen time than othersRecommendation: Watch in IMAX, Don't watch the TV spots as they show most of the scenes Rating 8/10 (over all)(If JP1 was 10/10 and number 1/10 would be JP3)"
10,Stomps the others out of the Park,22 June 2015,"This movie is so harshly critiqued by many for all the wrong reasons, this movie delivers in brilliant story, subtle yet well executed character development,superb special effects that I cannot fault and the acting in this movie is brought together perfectly with some big cinema names. I absolutely love this movie as it keeps the entertainment flowing and delivers a sense of engaging and exciting realism due to the well thought out storyline. And when people say it is predictable, it is because the read description. People need to wake up and realise that this movie is making millions because it is a masterpiece, I have already seen it a few times. I give it a rare 10/10"
10,Dream Come's True!,22 June 2015,"This is the 4th film of the greatest Jurassic Park series and one of my favorite movie. I was very excited to watch this movie since i saw its trailer for the first time. When ever i saw any part of this series playing of TV channels, i just sit to watch it hahahaha :D.I have decided to watch this movie with my friends, as we all are just crazy about the Jurassic world. We have decided to wear the same Brown leather Vest in the premier which Chris Pratt worn in this movie. We all were looking exactly same as Owen character which was done by Chris Pratt in this part, Thanks to the Fjackets.com for the perfect costume and making our day.The Role of each actor in this movie is worth especially Chris Pratt and Irfan Khan. This was the best part i have ever seen in this series, WORTH WATCHING."
10,The best Jurassic park movie,4 March 2016,The first three Jurassic park movie are very scary. But this movie is scarier. 7.1 is underrating this movie. This is one of the scariest movies of all time. It is better then 7.1. All the Jurassic Park movie are great movies and this is the best one. This is one of the best scenes fiction movie of all time. This movie has great special effects. It also has a great story line. It also has great acting. Colin Trevorrow is a great director. Chris Pratt is a great actor. Bryce Dallas Howard is a great actresses. Ty Simpkins is a great actor. Nick Robinson is a great actor. See this movie. See all the Jurassic park movies.
10,How to tame your raptor,15 June 2015,"I just recently watched the movie Jurassic World and needless to say, it was EXCELLENT...From the beginning to the end, there was enough action, and surprisingly, a lot of humor to find in between the action scenes. There is some gore to be found in the movie (It is a horror genre with Dino's, after all...) but there wasn't all too much graphic scenes. You could easily take your children to the movie without having to worry about blood or other gruesome things for your kids to see (WARNING: You will see some people got eaten, but as I just mentioned, NO BLOOD)The story takes place on isla Nublar, in Costa Rica. None of the previous characters are involved in this film seeing as how John Hammond has passed away and the previous characters have nothing to do with this movie. However, the new introductions bring a few fresh faces to the genre and the story divides screen time evenly between the main characters so the movie isn't focused on 1 specific character.If you are a fan from Jurassic Park or any Dino-themed movie, this is definitely for you."
10,"Delivers where last year's Godzilla, failed.",13 June 2015,"Spoilers - To be honest, I had low expectations going into this film. The lack of returning ""Stars"" from the other three films was sort of a let down but I have to say, Jurassic World blew me away. Even though I was hoping for some familiar faces, I was really going to see this film for one reason. Dinosaurs. And this film delivered all kinds of dinosaurs, both old and new. Sure, there's some plot holes and you really need to have a suspension of disbelief at some moments but that was the case with the original and it's sequels. I don't go to see Star Wars, Godzilla or Indiana Jones and pick it apart for it's realism or lack of, either. It's a fantasy ride and that's how one should approach it. I am also a huge fan of the other 3 JP films including JP3 which I see some folks bashing in their reviews here. I've also noticed a lot of people bashing Peter Jackson's Kong on that particular page. I'm not sure what their tastes are but I'm a huge fan of old monster films like Universal Monsters, King Kong, Godzilla, Jaws and Dino films like The Beast from 20,000 Fathoms, Valley of Gwangi and One Million Years BC. I thought Jackson nailed it with his version of KK as he's a huge fan and made a film he wanted to see and I feel the filmmakers behind Jurassic World nailed it as they realized what was most important...tons of DINO ACTION. Unlike last year's Godzilla, JW gives a majority of screen time to dino carnage. This is probably the scariest of the 4 Jurassic films and the ending was the grandest of all the films. Great ending. The T-Rex is supposedly the same T-Rex from the original. I loved the little cameos by Jeff Goldblum in the background on the cover of books, etc. I loved the homages to the original film by revisiting the original complex and using the original jeeps. The homage to Jaws. I thought Chris Pratt did a great job. All in all, it was a huge success in my eyes. I can't wait for the Blu-ray and I hope they continue with more sequels."
10,one word: EPIC,15 June 2015,"1. I understand the critics. There is a bit of dumb writing, a few stereotypical characters, and they make a few unrealistic decisions.but....All the rest of the movie makes up for that. There is the AWWW effect, there is breathtaking suspense, there is unbelievable CGI, there is emotion, there is humor, there is action. This movie, especially on the big screen is only one word... EPIC. Also the finale of the movie was really amazing.For me it was the best cinematic experience ever. I recommend u see it in IMAX 3-D"
10,Very fun to watch 10/10 recommend to see.,13 June 2015,"Loved it. I thought the movie was entertaining and thrilling. Stuck to the original recipe that made the first Jurassic Park movie so good, though they spiced it up with new features. E.I the Raptor's and the new park toys etc. Chris Pratt was amazing in this. Their choice of actor was perfect and it makes me very enthused to see any new movies he will be apart of. The children cast was also incredible. Vincent Denofrio, once again the creep but of course is excellent at it. His character was a little one dimensional though. All-in-all I enjoyed the jump scares and the tense atmosphere the movie held and the fun vibrant feel throughout the movie. Very fun to watch 10/10 recommend to see."
10,"Brilliant watch, ignore the buffs",17 June 2015,"The movie buffs always like to get their panties in a bunch when a new movie revisits one of their favorites from childhood, the same goes here.I know how the last Jurassic movie didn't work out and how the new terminator movie would presumably ruin our childhood as well. do not try to compare this with the Spielberg classic, it's its own movie with its own traits , and a very well done one in its own right. there are some cheesy moments, and story might feel unresolved in certain places with plot holes here and there, but overall, a brilliant movie to watch in 3D, would be money well spent and most importantly you will not be disappointed. period,it might not be a 10/10 movie , more like a 7.5/10 movie but the score is due to some unfair reviews and the circle-jerk it creates."
1,Does not deserve the hype it gets,31 August 2015,"I am giving this title a 1 in an attempt to bring down the score that it does not currently deserve.This movie had its cool moments, but mostly just dumb.Way too many special effects and just unrealistic scenarios. e.g. At one point a woman in high heels is outrunning a T-rex. Remember in the original Jurrasic park the T-Rex was chasing down a Jeep at top speed!No spoilers but the ending is terrible and cheesy.Chris Pratt is pretty much just an extra in his own movie.It's a shame that it got so much hype that they are already planning the sequel. I am glad I got free cinema tickets when I saw this and didn't pay any money."
10,Best Jurassic Park Ever Made and Best 2015 Blockbuster Hands Down!!,23 June 2015,I'm so angry Extremely angry at those comments which undermined that great movie to the extent that after reading the reviews here I felt so much this movie will turn up to be a let down and was about to skip it!! The only reason I went to see it after reading those reviews which all pointed that its not all that also said not bad yet not great was that I had nothing else better to do that evening!! and Boy was I so wrong!!!! Seriously at least 70% of the comments out here are so damn faithful to Jurassic 1&2 to the extent they became blinded to anything that could actually be better!! And to be fair to those who dissed this movie they all pointed out that it is better than the 3rd installment which to me meant nothing much because Part 3 was a total waste of time and anything compared to it will be better!! Therefor I seriously considered waiting for it to come on DVD instead of wasting valuable time driving down to me local IMAX to watch it!! Well I went with almost zero expectations which is not good in my case because it makes me see the worst in a movie instead of being optimistic and boy that movie rocked me side way upwards downwards you name it and the strength ultimately came from the amazing extra ordinary story line and the effects combined with some amazing direction and camera work that blow me away!! I immediately went down to memory lane to remind myself how good really Jurassic Park 1&2 actually were?!!However I could not help myself thinking this story line and movie all together is actually better way better than the original Jurassic Park and the reason for this is that this movie is more serious you may say and darker than the first two with a solid captivating story line that I would expect would catch the attention of almost anyone serious about movies. I consider myself one of the world's best movie watchers and if there was an award I would surely run for it because I have seen almost every decent movie that has come out from 1965 till now with a few exceptional ones beyond those dates!! That doesn't mean that my taste in movies would appeal to everyone nor it means I know better than the rest of you may be just a little bit!!!! This movie is world class and by far the best Blockbuster of 2015 Hands both Down!! Go watch it folks and be fair when you rate a movie
10,Better than the first,17 June 2015,"I loved this movie, I saw it opening night. First of the characters are good. Chris Pratt and everyone else did a wonderful job. The dinosaurs look awesome, in fact they look better at the end, you can tell they wanted to put a lot more effort in the 2nd half of this movie and that's not a bad thing. They make it very emotional. That seen with the dinosaur dying made me tear up. The ending is the best ending to any movie ever. When the Tyrannosaurus Rex came out I was so happy and when Blue saved him that also made me happy. When the giant sea monster killed the bad dinosaur, I started clapping and everyone in the theater did too. So now I have a poster on my wall, the entire soundtrack on my computer(my the way, the score's awesome) and have seen it twice already and am hopefully going to see this masterpiece again."
10,Best Sequel to Jurassic Park,17 August 2015,"I had my doubts about Jurassic World when the trailers debuted last year. But they kept getting better and better until I finally thought to myself, ""this might be a good one."" Believe it or not, I was right. The main characters of Claire and Owen, the music by Michael Giacchino, and the concept of an open Dinosaur park really drove the story to its potential as a good sequel. Every movie has their problems, and this one did have a few but not enough to say that I was mislead. The audience and critics may be all over the place with this movie but hey, Haters gonna hate. This is truly the best sequel to Jurassic Park to me and has earned its place with the best sequels along with the upcoming Star Wars: The Force Awakens. If you see the film, see it with your own mindset and not what other people say."
10,The Most Underrated Film Of 2015,13 June 2015,"It's officially the most underrated movie of all time now. i loved this movie its now my second best Jurassic movie and I analyzed the movie just as much as you did. This movie actually made me a fan of the series. the massive issues with the reviews online is that they expect it to be better than the first, when its not going for that at all. Its being released YEARS from 3, its a complete refresh. I loved the movie it exceeded past my original assumption that it would be mediocre. I'm glad I chose this movie, i hope these reviews online stop comparisons and look at it as a completely fresh sequel to the Jurassic movie series."
