score,title,time,review10,Family Time,28 August 2017,"When a sequel is released following in the footsteps of a popular and well-loved movie the bar is set high by any and all going to see it. Expectations are high and if the follow up doesn't equal that of the first film it could result in the end of a series or low box office figures. Termed the ""sophomore slump"" more than one second film has fallen prey to this occurring.I've loved all of the Marvel Universe films (and Netflix series) to date, more so than any that DC has released where only WONDER WOMAN has succeeded. I enjoyed GUARDIANS OF THE GALAXY immensely, a perfect combination of action, comic book love, special effects and humor. When the sequel, GUARDIANS OF THE GALAXY VOL. 2 came out I was there the first week to see it. I left disappointed feeling it hadn't lived up to my expectations. So I was anxious for it to come out on disc so I could watch it again and see it through different eyes, eyes not filled with expectations of the previous film. I'm glad I did.The movie starts in the distant past as Peter Quill's mother Meredith rides down the road in an open topped convertible singing ""Brandy"" as her handsome young beau (Kurt Russell) drives. They end up in a woods where he shows her something he has planted in the ground and both convey their love for one another. Fast forward to outer space.The Guardians have been hired by the Sovereign to protect their all-important batteries from a marauding inter-dimensional monster. As it arrives the battle begins as does my favorite part of the film. Baby Groot hooks up a sound system to play music, something Peter aka Star Lord (Chris Pratt) enjoys. With the tune ""Mr. Blue Sky"" blaring from the speakers baby Groot dances across the battlefield oblivious to the raging fight taking place around him. If it doesn't make your heart dance with joy to see him you have no heart.The team is victorious and get their reward – Nebula (Karen Gillan) Gamora's (Zoe Saldana) sister. Peter warns them to be cautious as the Sovereign are an easily offended group which of course results in Rocket (voice of Bradley Cooper) cracking wise at their expense. Heading out into space they are then attacked by the Sovereign, looking for the batteries stolen by Rocket which he failed to mention. As things appear to be at their worst another spaceship shows up with a man on top who obliterates the remaining Sovereign ships.Crash landing and beginning repairs that same spaceship lands and out walks a man known as Ego who informs Peter that he is his father. Here before him is the man he's been searching for all these years. A man who has been searching for Peter as well. While Rocket and Groot remain behind to fix the ship, with Nebula still a prisoner, the rest go with Ego to his planet at the far edge of the galaxy. But what is it that he really wants? This will become the problem all face eventually.As this unfolds we also find out what has become of Yondu (Michael Rooker), Peter's once father figure and the man who was tracking him down in the first film. We learn that his particular group of Ravagers were exiled because of his taking Peter years ago. At his lowest he is approached by the Sovereign to find the Guardians and retrieve their batteries.Two themes run throughout this film. The first is that of family and fathers in particular. The Guardians are more than just a rag tag group of adventurers. Each has lost something or someone in their past and they have bonded together as a family in their time together. And each father figure has some flaw that makes them not the father they could have been but all attempt to redeem themselves for the most part save one. This presents a much deeper film than one would expect from a comic based movie.The movie entertains on all levels from the stunning special effects visuals to the story telling itself. The acting is amazing when you consider that beneath the bluster and wise cracking heroics on display is that search for answers to familial matters. This includes not just fathers but sisters as well with Nebula and Gamora trying to find their own answers. In addition to that there are some belly busting funny moments as well, nearly all involving Drax (Dave Batista) who does a fantastic job with them.On second viewing, without preconceived ideas in mind, I loved this movie. It might not be equal to the first but it is very close. The concepts that run through this film strike at the heart which is never a bad thing when handled well. Here it is handled exceptionally well. This is a movie to be added to any and all collections and watched more than once."
10,Great movie and very entertaining,17 May 2017,"Positive + Interesting plot but a bit simplistic. + Very funny, even more than actual comedies. + Great character development. We learn more about all the characters, their past and their motivations. + Amazing visuals. + Good action sequences. + Baby Groot is very cute.Negative - The main villain looses his recognizable face, making it harder for the viewer to feel him as the bad guy. - Yondu's arrow is much too powerful, a way to solve any difficult situation. Feels almost like cheating.Great movie. Might not be as big as the first but still very entertaining.5 Stars"
10,"""Sha-la-la-la-la-la thing""",8 May 2017,"""Oooh-oooh baby, we've been a long, long way and"".. seeing continuing of Guardians adventures and all that crazy things that happened in galaxy, I am lucky, because movie is greatest than first one. First minutes and I already think that it is, so beautiful and creative, funny and with some life. You look and live there on screens and feel all that fells Guardian team. Of course, director and screenwriter are great guys and other production team that in such nice way filmed that. Aah, music, make a big job there, great songs, they are beautiful and like to listening them, they make some deep emotions into movie with fun and sadness at same time. Oh, and actors, already knowing old retro-guy Kurt Russell and I don't know about Sylvester Stallone and was very surprised when I see him on screen, he is great, oh nostalgia. Beautiful Gamora, charismatic Peter Quill, love this character, MAN, and crazy Drax, reactive Rocket and cute kid Groot, and story around Yondu warmed my heart. It is funny and nice that they put a lot of different stories about each other, they have stories and a lot to say, in one move where interweave in one and one end, that was lovely to tears, exactly, tears, I have cried and was proud and happy. This family and friendship such strong, and so nice to be part of that team, to see and to be there, even if a little time. And proud as well that I can see Guardians of the Galaxy and know more about. Maybe you can even write something more deep and great, some wham, bam shang-a-lang and a sha-la-la-la-la-la review things, but that's all about this movie - wham bam shang-a-lang and more!"
10,Best Marvel Flick to Date,6 May 2017,"Being its own universe away from the comics (as has always been) I went into this already knowing to expect some things I've known and loved since childhood reading comics, as well as surprising things that were and are new to the MCU. Blew me away to say the least. I got the nostalgia feeling mixed with the new action packed and new spins on characters feelings :). Nothing I didn't like about this movie to be honest so rated a perfect 10. Graphics were amazing, acting was great, it was hilarious at moments, action-packed throughout, and had me at the edge of my seat for the duration. I think this is all a movie should do and it achieved it."
1,Dreadful - 180 degrees from the first one,19 May 2017,"Me and my boy were thinking wtf is going on in the cinema. Everyone in GOTG has gone emotional & sentimental, looking for sister touch, father touch. Action is sporadic and childish. No cool moments, musics have lost the spirits. Way less funny than the first one. I hardly laughed, like watching paint dry. My 13 years son ends up playing on his mobile, not bother watching.How other people love this move is beyond me. Obviously they have very different standard, easily entertained."
1,What the hell did I just watch?,6 May 2017,"I actually lost a lot of brain cells today. I should have trusted my instinct which told me after 10 minutes of atrociously written, poorly shot and nauseatingly acted nonsense that I should leave. But I said to myself, lets stick, maybe it will redeem itself.Oh, but no, it just got worse and worse till it crossed all lines of idiocy. The characters were like disposable stick figures with no concept of personality at all. Jokes were bad, really really bad and you could feel how pathetically they were inserted into the movie just to give it some redeeming value in form of comic reliefs which also failed.I left in the mid-movie as I could just easily sit and stare at a blank wall and pay money for it. I still lose the money but at-least get to keep my neurons alive."
1,2+ hours of my life wasted,28 May 2017,"What an awful movie! Totally self-indulgence, overly-sentimental, look-how-cute-we-are movie. No plot -zero, none - just sweetness and lace. Ridiculous waste of time. The first movie was witty, sharply written, original. This one - exactly the opposite. Nothing witty, nothing original, just so much ""cuteness"" I wanted to stick my fingers down my throat and barf.Save your money, but more importantly save your time, and skip this horrendous so-called movie."
